{
  "version": 1,
  "feature": "pickdrop reservation",
  "prototype": "F:\\documents\\pet-care-system-prototype-biz-web-main",
  "generatedAt": "2026-05-13T08:41:21.729Z",
  "analysisMode": "js-case-first",
  "keywords": [
    "pickdrop",
    "pickup",
    "dropoff"
  ],
  "summary": {
    "sourceFileCount": 103,
    "relevantFileCount": 27,
    "caseGroupCount": 10,
    "caseCount": 160,
    "policyGapCount": 82
  },
  "caseGroups": [
    {
      "id": "CG-01",
      "title": "Pickdrop mode transition",
      "sourceFiles": [
        "../../../documents/pet-care-system-prototype-biz-web-main/src/pages/reservation.js"
      ],
      "cases": [
        {
          "id": "CG-01-C01",
          "title": "logic branch when !ignorePickdrop && getReservationMode(elements) === \"pickdrop\" -> if (!ignorePickdrop && getReservationMode(elements) === \"pickdrop\") {",
          "trigger": "logic branch",
          "conditions": [
            "!ignorePickdrop && getReservationMode(elements) === \"pickdrop\""
          ],
          "expectedBehavior": [
            "if (!ignorePickdrop && getReservationMode(elements) === \"pickdrop\") {"
          ],
          "stateChanges": [],
          "dataImpact": [],
          "uiSelectors": [],
          "sourceRefs": [
            "../../../documents/pet-care-system-prototype-biz-web-main/src/pages/reservation.js:186"
          ],
          "policyGapRefs": []
        },
        {
          "id": "CG-01-C02",
          "title": "logic branch when getReservationMode(elements) === \"pickdrop\" -> if (getReservationMode(elements) === \"pickdrop\") {",
          "trigger": "logic branch",
          "conditions": [
            "getReservationMode(elements) === \"pickdrop\""
          ],
          "expectedBehavior": [
            "if (getReservationMode(elements) === \"pickdrop\") {"
          ],
          "stateChanges": [],
          "dataImpact": [],
          "uiSelectors": [],
          "sourceRefs": [
            "../../../documents/pet-care-system-prototype-biz-web-main/src/pages/reservation.js:255"
          ],
          "policyGapRefs": []
        },
        {
          "id": "CG-01-C03",
          "title": "state sync when !isPickdropMode -> Update enabled or disabled state.",
          "trigger": "state sync",
          "conditions": [
            "!isPickdropMode"
          ],
          "expectedBehavior": [
            "Update enabled or disabled state."
          ],
          "stateChanges": [
            "pickdropToggle.disabled = isPickdropMode ? !enabled : !canGoToPickdrop",
            "pickdropToggle.textContent = activeDates.size > 0 ? \"픽드랍까지 예약\" : \"픽드랍만 예약\""
          ],
          "dataImpact": [],
          "uiSelectors": [],
          "sourceRefs": [
            "../../../documents/pet-care-system-prototype-biz-web-main/src/pages/reservation.js:320"
          ],
          "policyGapRefs": [
            "GAP-001",
            "GAP-002"
          ]
        },
        {
          "id": "CG-01-C04",
          "title": "logic branch when !isPickdropMode -> if (!isPickdropMode) {",
          "trigger": "logic branch",
          "conditions": [
            "!isPickdropMode"
          ],
          "expectedBehavior": [
            "if (!isPickdropMode) {"
          ],
          "stateChanges": [
            "pickdropToggle.textContent = activeDates.size > 0 ? \"픽드랍까지 예약\" : \"픽드랍만 예약\""
          ],
          "dataImpact": [],
          "uiSelectors": [],
          "sourceRefs": [
            "../../../documents/pet-care-system-prototype-biz-web-main/src/pages/reservation.js:321"
          ],
          "policyGapRefs": [
            "GAP-003"
          ]
        },
        {
          "id": "CG-01-C05",
          "title": "state sync when mode !== \"pickdrop\" -> Show or hide dependent UI.",
          "trigger": "state sync",
          "conditions": [
            "mode !== \"pickdrop\""
          ],
          "expectedBehavior": [
            "Show or hide dependent UI."
          ],
          "stateChanges": [
            "elements.pickdropTicketField.hidden = mode !== \"pickdrop\""
          ],
          "dataImpact": [],
          "uiSelectors": [],
          "sourceRefs": [
            "../../../documents/pet-care-system-prototype-biz-web-main/src/pages/reservation.js:1514"
          ],
          "policyGapRefs": [
            "GAP-004"
          ]
        },
        {
          "id": "CG-01-C06",
          "title": "state sync when mode !== \"pickdrop\" -> Show or hide dependent UI.",
          "trigger": "state sync",
          "conditions": [
            "mode !== \"pickdrop\"",
            "elements.pickdropTicketField",
            "elements.pickdropTicketEmpty"
          ],
          "expectedBehavior": [
            "Show or hide dependent UI."
          ],
          "stateChanges": [
            "elements.pickdropTicketField.textContent = \"\"",
            "elements.pickdropTicketEmpty.hidden = true"
          ],
          "dataImpact": [],
          "uiSelectors": [],
          "sourceRefs": [
            "../../../documents/pet-care-system-prototype-biz-web-main/src/pages/reservation.js:1516"
          ],
          "policyGapRefs": [
            "GAP-005",
            "GAP-006"
          ]
        },
        {
          "id": "CG-01-C07",
          "title": "state sync when mode === \"pickdrop\" -> Recalculate pricing and fee summary.",
          "trigger": "state sync",
          "conditions": [
            "mode === \"pickdrop\"",
            "disabledIds = mode === \"pickdrop\""
          ],
          "expectedBehavior": [
            "Recalculate pricing and fee summary.",
            "Show or hide dependent UI."
          ],
          "stateChanges": [
            "ticketPlaceholder.hidden = !formState.selectedMember"
          ],
          "dataImpact": [
            "mutate form state",
            "recalculate billing data"
          ],
          "uiSelectors": [],
          "sourceRefs": [
            "../../../documents/pet-care-system-prototype-biz-web-main/src/pages/reservation.js:1884"
          ],
          "policyGapRefs": [
            "GAP-007",
            "GAP-008"
          ]
        },
        {
          "id": "CG-01-C08",
          "title": "logic branch when mode === \"pickdrop\" -> if (mode === \"pickdrop\") {",
          "trigger": "logic branch",
          "conditions": [
            "mode === \"pickdrop\"",
            "!formState.pickdropSelectionsInitialized && formState.ticketSelections.length === 0 && pickdropOptions.length > 0",
            "serviceOptions.length > 0"
          ],
          "expectedBehavior": [
            "if (mode === \"pickdrop\") {"
          ],
          "stateChanges": [],
          "dataImpact": [
            "mutate form state"
          ],
          "uiSelectors": [],
          "sourceRefs": [
            "../../../documents/pet-care-system-prototype-biz-web-main/src/pages/reservation.js:1920"
          ],
          "policyGapRefs": []
        },
        {
          "id": "CG-01-C09",
          "title": "logic branch when pickdropMode -> Enter pickdrop mode.",
          "trigger": "logic branch",
          "conditions": [
            "pickdropMode"
          ],
          "expectedBehavior": [
            "Enter pickdrop mode."
          ],
          "stateChanges": [],
          "dataImpact": [],
          "uiSelectors": [],
          "sourceRefs": [
            "../../../documents/pet-care-system-prototype-biz-web-main/src/pages/reservation.js:2356"
          ],
          "policyGapRefs": []
        },
        {
          "id": "CG-01-C10",
          "title": "click when isPickdrop -> Enter pickdrop mode.",
          "trigger": "click",
          "conditions": [
            "isPickdrop",
            "isPickdrop = modal.classList.contains(\"is-pickdrop\")"
          ],
          "expectedBehavior": [
            "Enter pickdrop mode.",
            "Submit reservation data.",
            "Update visual state classes."
          ],
          "stateChanges": [
            "firstStep?.classList.remove(\"is-complete\", \"is-active\")",
            "secondStep?.classList.remove(\"is-active\", \"is-complete\")",
            "firstStep?.classList.add(\"is-active\")",
            "firstStep?.classList.add(\"is-complete\")",
            "firstStep?.classList.remove(\"is-active\")",
            "secondStep?.classList.add(\"is-active\")"
          ],
          "dataImpact": [
            "write reservation data",
            "delete or remove data"
          ],
          "uiSelectors": [],
          "sourceRefs": [
            "../../../documents/pet-care-system-prototype-biz-web-main/src/pages/reservation.js:2878"
          ],
          "policyGapRefs": [
            "GAP-009"
          ]
        },
        {
          "id": "CG-01-C11",
          "title": "keydown -> Enter pickdrop mode.",
          "trigger": "keydown",
          "conditions": [],
          "expectedBehavior": [
            "Enter pickdrop mode.",
            "Update visual state classes."
          ],
          "stateChanges": [
            "firstStep?.classList.add(\"is-active\")",
            "firstStep?.classList.add(\"is-complete\")",
            "firstStep?.classList.remove(\"is-active\")",
            "secondStep?.classList.add(\"is-active\")"
          ],
          "dataImpact": [
            "delete or remove data"
          ],
          "uiSelectors": [],
          "sourceRefs": [
            "../../../documents/pet-care-system-prototype-biz-web-main/src/pages/reservation.js:2886"
          ],
          "policyGapRefs": []
        },
        {
          "id": "CG-01-C12",
          "title": "logic branch when getReservationMode(elements) === \"pickdrop\" -> if (getReservationMode(elements) === \"pickdrop\") {",
          "trigger": "logic branch",
          "conditions": [
            "getReservationMode(elements) === \"pickdrop\""
          ],
          "expectedBehavior": [